{
  "date": "2026-10-21",
  "collected_at": "2026-10-22 00:00",
  "github": [
    {
      "full_name": "morluto/rea",
      "url": "https://github.com/morluto/rea",
      "description": "Reverse engineer anything with agents, from app behavior down to native binaries.",
      "language": "TypeScript",
      "stars_total": 355179,
      "stars_today": 4332,
      "stars_today_source": "star_history",
      "forks": 89207,
      "created_at": "2026-04-14",
      "pushed_at": "2026-10-21"
    },
    {
      "full_name": "mattpocock/skills",
      "url": "https://github.com/mattpocock/skills",
      "description": "Skills for Real Engineers. Straight from my .agents directory.",
      "language": "Shell",
      "stars_total": 299524,
      "stars_today": 553,
      "stars_today_source": "star_history",
      "forks": 25151,
      "created_at": "2026-02-03",
      "pushed_at": "2026-10-21"
    },
    {
      "full_name": "anomalyco/opencode",
      "url": "https://github.com/anomalyco/opencode",
      "description": "The open source coding agent.",
      "language": "TypeScript",
      "stars_total": 219527,
      "stars_today": 358,
      "stars_today_source": "star_history",
      "forks": 29285,
      "created_at": "2025-04-30",
      "pushed_at": "2026-10-21"
    },
    {
      "full_name": "affaan-m/ECC",
      "url": "https://github.com/affaan-m/ECC",
      "description": "The agent harness performance optimization system. Skills, instincts, memory, security, and research-first development for Claude Code, Codex, Opencode, Cursor and beyond.",
      "language": "JavaScript",
      "stars_total": 285340,
      "stars_today": 293,
      "stars_today_source": "star_history",
      "forks": 42318,
      "created_at": "2026-01-18",
      "pushed_at": "2026-10-20"
    },
    {
      "full_name": "obra/superpowers",
      "url": "https://github.com/obra/superpowers",
      "description": "An agentic skills framework & software development methodology that works.",
      "language": "Shell",
      "stars_total": 302988,
      "stars_today": 290,
      "stars_today_source": "star_history",
      "forks": 26993,
      "created_at": "2025-10-09",
      "pushed_at": "2026-10-21"
    },
    {
      "full_name": "firecrawl/firecrawl",
      "url": "https://github.com/firecrawl/firecrawl",
      "description": "Supercharge your AI agents with data from the web and beyond. Building the library for superintelligence. 🔥",
      "language": "TypeScript",
      "stars_total": 193774,
      "stars_today": 207,
      "stars_today_source": "star_history",
      "forks": 10224,
      "created_at": "2024-04-15",
      "pushed_at": "2026-10-21"
    },
    {
      "full_name": "NousResearch/hermes-agent",
      "url": "https://github.com/NousResearch/hermes-agent",
      "description": "The agent that grows with you",
      "language": "Python",
      "stars_total": 255793,
      "stars_today": 145,
      "stars_today_source": "star_history",
      "forks": 55764,
      "created_at": "2025-07-22",
      "pushed_at": "2026-10-21"
    },
    {
      "full_name": "public-apis/public-apis",
      "url": "https://github.com/public-apis/public-apis",
      "description": "A collective list of free APIs",
      "language": "Python",
      "stars_total": 491048,
      "stars_today": 128,
      "stars_today_source": "star_history",
      "forks": 54581,
      "created_at": "2016-03-20",
      "pushed_at": "2026-10-21"
    },
    {
      "full_name": "vinta/awesome-python",
      "url": "https://github.com/vinta/awesome-python",
      "description": "The definitive list that answers \"I want to do X in Python, which tool should I use?\"",
      "language": "Python",
      "stars_total": 329187,
      "stars_today": 118,
      "stars_today_source": "star_history",
      "forks": 28975,
      "created_at": "2014-06-27",
      "pushed_at": "2026-10-21"
    },
    {
      "full_name": "yt-dlp/yt-dlp",
      "url": "https://github.com/yt-dlp/yt-dlp",
      "description": "A feature-rich command-line audio/video downloader",
      "language": "Python",
      "stars_total": 199915,
      "stars_today": 118,
      "stars_today_source": "star_history",
      "forks": 17419,
      "created_at": "2020-10-26",
      "pushed_at": "2026-10-21"
    },
    {
      "full_name": "torvalds/linux",
      "url": "https://github.com/torvalds/linux",
      "description": "Linux kernel source tree",
      "language": "C",
      "stars_total": 253000,
      "stars_today": 75,
      "stars_today_source": "star_history",
      "forks": 67993,
      "created_at": "2011-09-04",
      "pushed_at": "2026-10-21"
    },
    {
      "full_name": "openclaw/openclaw",
      "url": "https://github.com/openclaw/openclaw",
      "description": "The AI that really does things. Any OS. Any Platform. The lobster way. 🦞 ",
      "language": "TypeScript",
      "stars_total": 392664,
      "stars_today": 69,
      "stars_today_source": "star_history",
      "forks": 82539,
      "created_at": "2025-11-24",
      "pushed_at": "2026-10-21"
    },
    {
      "full_name": "n8n-io/n8n",
      "url": "https://github.com/n8n-io/n8n",
      "description": "Fair-code workflow automation platform with native AI capabilities. Combine visual building with custom code, self-host or cloud, 400+ integrations.",
      "language": "TypeScript",
      "stars_total": 208225,
      "stars_today": 53,
      "stars_today_source": "star_history",
      "forks": 61211,
      "created_at": "2019-06-22",
      "pushed_at": "2026-10-21"
    },
    {
      "full_name": "nilbuild/developer-roadmap",
      "url": "https://github.com/nilbuild/developer-roadmap",
      "description": "Interactive roadmaps, guides and other educational content to help developers grow in their careers.",
      "language": "TypeScript",
      "stars_total": 370047,
      "stars_today": 43,
      "stars_today_source": "star_history",
      "forks": 45131,
      "created_at": "2017-03-15",
      "pushed_at": "2026-10-20"
    },
    {
      "full_name": "EbookFoundation/free-programming-books",
      "url": "https://github.com/EbookFoundation/free-programming-books",
      "description": ":books: Freely available programming books",
      "language": "Python",
      "stars_total": 399735,
      "stars_today": 36,
      "stars_today_source": "star_history",
      "forks": 66976,
      "created_at": "2013-10-11",
      "pushed_at": "2026-10-20"
    },
    {
      "full_name": "freeCodeCamp/freeCodeCamp",
      "url": "https://github.com/freeCodeCamp/freeCodeCamp",
      "description": "freeCodeCamp.org's open-source codebase and curriculum. Learn math, programming, and computer science for free.",
      "language": "TypeScript",
      "stars_total": 457625,
      "stars_today": 34,
      "stars_today_source": "star_history",
      "forks": 49265,
      "created_at": "2014-12-24",
      "pushed_at": "2026-10-21"
    },
    {
      "full_name": "react/react",
      "url": "https://github.com/react/react",
      "description": "The library for web and native user interfaces.",
      "language": "JavaScript",
      "stars_total": 251612,
      "stars_today": 29,
      "stars_today_source": "star_history",
      "forks": 51564,
      "created_at": "2013-05-24",
      "pushed_at": "2026-10-21"
    },
    {
      "full_name": "microsoft/vscode",
      "url": "https://github.com/microsoft/vscode",
      "description": "Visual Studio Code",
      "language": "TypeScript",
      "stars_total": 194177,
      "stars_today": 20,
      "stars_today_source": "star_history",
      "forks": 45450,
      "created_at": "2015-09-03",
      "pushed_at": "2026-10-21"
    },
    {
      "full_name": "tensorflow/tensorflow",
      "url": "https://github.com/tensorflow/tensorflow",
      "description": "An Open Source Machine Learning Framework for Everyone",
      "language": "C++",
      "stars_total": 201162,
      "stars_today": 19,
      "stars_today_source": "star_history",
      "forks": 79316,
      "created_at": "2015-11-07",
      "pushed_at": "2026-10-21"
    },
    {
      "full_name": "TheAlgorithms/Python",
      "url": "https://github.com/TheAlgorithms/Python",
      "description": "All Algorithms implemented in Python",
      "language": "Python",
      "stars_total": 225434,
      "stars_today": 13,
      "stars_today_source": "star_history",
      "forks": 51200,
      "created_at": "2016-07-16",
      "pushed_at": "2026-10-20"
    }
  ],
  "gaps": [
    "候选 100 个，入榜 20 个",
    "star_history 调用 20 次（上限 20），失败 0 次"
  ]
}
