{
  "date": "2026-10-11",
  "collected_at": "2026-10-11 20:00",
  "github": [
    {
      "full_name": "DietrichGebert/ponytail",
      "url": "https://github.com/DietrichGebert/ponytail",
      "description": "Makes your AI agent think like the laziest senior dev in the room. The best code is the code you never wrote.",
      "language": "JavaScript",
      "stars_total": 160307,
      "stars_today": 483,
      "stars_today_source": "star_history",
      "forks": 8622,
      "created_at": "2026-06-12",
      "pushed_at": "2026-10-10"
    },
    {
      "full_name": "affaan-m/ECC",
      "url": "https://github.com/affaan-m/ECC",
      "description": "The agent harness performance optimization system. Skills, instincts, memory, security, and research-first development for Claude Code, Codex, Opencode, Cursor and beyond.",
      "language": "JavaScript",
      "stars_total": 276384,
      "stars_today": 307,
      "stars_today_source": "star_history",
      "forks": 41228,
      "created_at": "2026-01-18",
      "pushed_at": "2026-10-10"
    },
    {
      "full_name": "obra/superpowers",
      "url": "https://github.com/obra/superpowers",
      "description": "An agentic skills framework & software development methodology that works.",
      "language": "Shell",
      "stars_total": 297168,
      "stars_today": 209,
      "stars_today_source": "star_history",
      "forks": 26529,
      "created_at": "2025-10-09",
      "pushed_at": "2026-10-10"
    },
    {
      "full_name": "awesome-selfhosted/awesome-selfhosted",
      "url": "https://github.com/awesome-selfhosted/awesome-selfhosted",
      "description": "A list of Free Software network services and web applications which can be hosted on your own servers",
      "language": null,
      "stars_total": 325236,
      "stars_today": 181,
      "stars_today_source": "star_history",
      "forks": 15210,
      "created_at": "2015-06-01",
      "pushed_at": "2026-10-10"
    },
    {
      "full_name": "huggingface/transformers",
      "url": "https://github.com/huggingface/transformers",
      "description": "🤗 Transformers: the model-definition framework for state-of-the-art machine learning models in text, vision, audio, and multimodal models, for both inference and training. ",
      "language": "Python",
      "stars_total": 167139,
      "stars_today": 180,
      "stars_today_source": "star_history",
      "forks": 34796,
      "created_at": "2018-10-29",
      "pushed_at": "2026-10-10"
    },
    {
      "full_name": "firecrawl/firecrawl",
      "url": "https://github.com/firecrawl/firecrawl",
      "description": "Supercharge your AI agents with data from the web and beyond. Building the library for superintelligence. 🔥",
      "language": "TypeScript",
      "stars_total": 190180,
      "stars_today": 177,
      "stars_today_source": "star_history",
      "forks": 10085,
      "created_at": "2024-04-15",
      "pushed_at": "2026-10-10"
    },
    {
      "full_name": "NousResearch/hermes-agent",
      "url": "https://github.com/NousResearch/hermes-agent",
      "description": "The agent that grows with you",
      "language": "Python",
      "stars_total": 252493,
      "stars_today": 172,
      "stars_today_source": "star_history",
      "forks": 54579,
      "created_at": "2025-07-22",
      "pushed_at": "2026-10-10"
    },
    {
      "full_name": "flutter/flutter",
      "url": "https://github.com/flutter/flutter",
      "description": "Flutter makes it easy and fast to build beautiful apps for mobile and beyond",
      "language": "Dart",
      "stars_total": 179408,
      "stars_today": 145,
      "stars_today_source": "star_history",
      "forks": 33557,
      "created_at": "2015-03-06",
      "pushed_at": "2026-10-10"
    },
    {
      "full_name": "f/prompts.chat",
      "url": "https://github.com/f/prompts.chat",
      "description": "f.k.a. Awesome ChatGPT Prompts. Share, discover, and collect prompts from the community. Free and open source — self-host for your organization with complete privacy.",
      "language": "HTML",
      "stars_total": 172428,
      "stars_today": 138,
      "stars_today_source": "star_history",
      "forks": 22090,
      "created_at": "2022-12-05",
      "pushed_at": "2026-10-10"
    },
    {
      "full_name": "vinta/awesome-python",
      "url": "https://github.com/vinta/awesome-python",
      "description": "The definitive list that answers \"I want to do X in Python, which tool should I use?\"",
      "language": "Python",
      "stars_total": 326348,
      "stars_today": 131,
      "stars_today_source": "star_history",
      "forks": 28905,
      "created_at": "2014-06-27",
      "pushed_at": "2026-10-10"
    },
    {
      "full_name": "anomalyco/opencode",
      "url": "https://github.com/anomalyco/opencode",
      "description": "The open source coding agent.",
      "language": "TypeScript",
      "stars_total": 212528,
      "stars_today": 100,
      "stars_today_source": "star_history",
      "forks": 28402,
      "created_at": "2025-04-30",
      "pushed_at": "2026-10-10"
    },
    {
      "full_name": "avelino/awesome-go",
      "url": "https://github.com/avelino/awesome-go",
      "description": "A curated list of awesome Go frameworks, libraries and software",
      "language": "Go",
      "stars_total": 187716,
      "stars_today": 99,
      "stars_today_source": "star_history",
      "forks": 13607,
      "created_at": "2014-07-06",
      "pushed_at": "2026-10-10"
    },
    {
      "full_name": "tensorflow/tensorflow",
      "url": "https://github.com/tensorflow/tensorflow",
      "description": "An Open Source Machine Learning Framework for Everyone",
      "language": "C++",
      "stars_total": 200670,
      "stars_today": 93,
      "stars_today_source": "star_history",
      "forks": 78922,
      "created_at": "2015-11-07",
      "pushed_at": "2026-10-10"
    },
    {
      "full_name": "openclaw/openclaw",
      "url": "https://github.com/openclaw/openclaw",
      "description": "The AI that really does things. Any OS. Any Platform. The lobster way. 🦞 ",
      "language": "TypeScript",
      "stars_total": 391596,
      "stars_today": 69,
      "stars_today_source": "star_history",
      "forks": 82321,
      "created_at": "2025-11-24",
      "pushed_at": "2026-10-10"
    },
    {
      "full_name": "ollama/ollama",
      "url": "https://github.com/ollama/ollama",
      "description": "Get up and running with Kimi, GLM, MiniMax, DeepSeek, gpt-oss, Qwen, Gemma and other models.",
      "language": "Go",
      "stars_total": 182630,
      "stars_today": 67,
      "stars_today_source": "star_history",
      "forks": 18189,
      "created_at": "2023-06-26",
      "pushed_at": "2026-10-10"
    },
    {
      "full_name": "n8n-io/n8n",
      "url": "https://github.com/n8n-io/n8n",
      "description": "Fair-code workflow automation platform with native AI capabilities. Combine visual building with custom code, self-host or cloud, 400+ integrations.",
      "language": "TypeScript",
      "stars_total": 206920,
      "stars_today": 65,
      "stars_today_source": "star_history",
      "forks": 61049,
      "created_at": "2019-06-22",
      "pushed_at": "2026-10-10"
    },
    {
      "full_name": "langgenius/dify",
      "url": "https://github.com/langgenius/dify",
      "description": "Build Agentic workflows, RAG pipelines, with rich AI model and tool support on one collaborative workspace. Deploy on cloud, VPC, or self-hosted, so teams move from prototype to production without rebuilding the stack.",
      "language": "TypeScript",
      "stars_total": 158091,
      "stars_today": 48,
      "stars_today_source": "star_history",
      "forks": 24959,
      "created_at": "2023-04-12",
      "pushed_at": "2026-10-10"
    },
    {
      "full_name": "microsoft/vscode",
      "url": "https://github.com/microsoft/vscode",
      "description": "Visual Studio Code",
      "language": "TypeScript",
      "stars_total": 193521,
      "stars_today": 21,
      "stars_today_source": "star_history",
      "forks": 44967,
      "created_at": "2015-09-03",
      "pushed_at": "2026-10-10"
    }
  ],
  "gaps": [
    "候选集口径：搜索 API q=pushed:>=2026-10-10+stars:>=100（T-1d=2026-10-10），total_count≈15309（多次请求间在 15309–15311 间波动，属实时变化），按 sort=stars&order=desc 取前 100 为候选。",
    "本地差分 0 条：work/ 下仅存在 2026-10-09 的 collect.json，早于今日的最近一次基线日期为 2026-10-09，并非「上一自然日」（2026-10-10），按 spec 不得用于差分；故全部 20 个候选的 stars_today 均走 star_history 兜底，stars_today_source=star_history。",
    "star_history 调用 20 次（达 spec 上限 20 次/轮），均成功返回，按 stars_total 降序依次处理候选前 20 个，无 stars_today=null 的候选。",
    "星增量取值：star_history 按周分桶（每周 7 日），最新一周起点为 2026-10-04（周日），覆盖 2026-10-04 至 2026-10-10；委派日 2026-10-11 当日值尚未出现，按技能「当日值尚未出现时取最近一日」取该周最后一日（2026-10-10）的增量。",
    "受 star_history 上限约束，候选集前 100 个中其余 80 个未计算 stars_today、未纳入榜单；已计算的 20 个中，Significant-Gravitas/AutoGPT（stars_today=17）与 twbs/bootstrap（stars_today=6）因按 stars_today 降序取前 18 条而未入榜。",
    "工具单次网页响应约 55KB 后自动截断，搜索 API 以 per_page=8 分页获取候选前 24 条；本产物所需字段（全名/描述/语言/stars_total/forks/created_at/pushed_at）均完整。"
  ]
}
