{
  "date": "2026-10-09",
  "collected_at": "2026-10-09 19:05",
  "github": [
    {
      "full_name": "mattpocock/skills",
      "url": "https://github.com/mattpocock/skills",
      "description": "Skills for Real Engineers. Straight from my .agents directory.",
      "language": "Shell",
      "stars_total": 281878,
      "stars_today": 352,
      "stars_today_source": "star_history",
      "forks": 23618,
      "created_at": "2026-02-03",
      "pushed_at": "2026-10-09"
    },
    {
      "full_name": "deepseek-ai/deepseek-harness",
      "url": "https://github.com/deepseek-ai/deepseek-harness",
      "description": "DeepSeek Harness: Everything is a Plugin.",
      "language": "TypeScript",
      "stars_total": 246093,
      "stars_today": 165,
      "stars_today_source": "star_history",
      "forks": 29524,
      "created_at": "2026-08-13",
      "pushed_at": "2026-10-09"
    },
    {
      "full_name": "obra/superpowers",
      "url": "https://github.com/obra/superpowers",
      "description": "An agentic skills framework & software development methodology that works.",
      "language": "Shell",
      "stars_total": 296724,
      "stars_today": 72,
      "stars_today_source": "star_history",
      "forks": 26503,
      "created_at": "2025-10-09",
      "pushed_at": "2026-10-09"
    },
    {
      "full_name": "firecrawl/firecrawl",
      "url": "https://github.com/firecrawl/firecrawl",
      "description": "Supercharge your AI agents with data from the web and beyond. Building the library for superintelligence. 🔥",
      "language": "TypeScript",
      "stars_total": 189761,
      "stars_today": 72,
      "stars_today_source": "star_history",
      "forks": 10066,
      "created_at": "2024-04-15",
      "pushed_at": "2026-10-09"
    },
    {
      "full_name": "NousResearch/hermes-agent",
      "url": "https://github.com/NousResearch/hermes-agent",
      "description": "The agent that grows with you",
      "language": "Python",
      "stars_total": 252161,
      "stars_today": 64,
      "stars_today_source": "star_history",
      "forks": 54426,
      "created_at": "2025-07-22",
      "pushed_at": "2026-10-09"
    },
    {
      "full_name": "anomalyco/opencode",
      "url": "https://github.com/anomalyco/opencode",
      "description": "The open source coding agent.",
      "language": "TypeScript",
      "stars_total": 212302,
      "stars_today": 48,
      "stars_today_source": "star_history",
      "forks": 28352,
      "created_at": "2025-04-30",
      "pushed_at": "2026-10-09"
    },
    {
      "full_name": "anthropics/skills",
      "url": "https://github.com/anthropics/skills",
      "description": "Public repository for Agent Skills",
      "language": "Python",
      "stars_total": 180086,
      "stars_today": 46,
      "stars_today_source": "star_history",
      "forks": 21322,
      "created_at": "2025-09-22",
      "pushed_at": "2026-10-09"
    },
    {
      "full_name": "torvalds/linux",
      "url": "https://github.com/torvalds/linux",
      "description": "Linux kernel source tree",
      "language": "C",
      "stars_total": 251338,
      "stars_today": 41,
      "stars_today_source": "star_history",
      "forks": 67178,
      "created_at": "2011-09-04",
      "pushed_at": "2026-10-09"
    },
    {
      "full_name": "ollama/ollama",
      "url": "https://github.com/ollama/ollama",
      "description": "Get up and running with Kimi, GLM, MiniMax, DeepSeek, gpt-oss, Qwen, Gemma and other models.",
      "language": "Go",
      "stars_total": 182471,
      "stars_today": 41,
      "stars_today_source": "star_history",
      "forks": 18175,
      "created_at": "2023-06-26",
      "pushed_at": "2026-10-09"
    },
    {
      "full_name": "microsoft/vscode",
      "url": "https://github.com/microsoft/vscode",
      "description": "Visual Studio Code",
      "language": "TypeScript",
      "stars_total": 193486,
      "stars_today": 34,
      "stars_today_source": "star_history",
      "forks": 44746,
      "created_at": "2015-09-03",
      "pushed_at": "2026-10-09"
    },
    {
      "full_name": "openclaw/openclaw",
      "url": "https://github.com/openclaw/openclaw",
      "description": "The AI that really does things. Any OS. Any Platform. The lobster way. 🦞 ",
      "language": "TypeScript",
      "stars_total": 391519,
      "stars_today": 30,
      "stars_today_source": "star_history",
      "forks": 82306,
      "created_at": "2025-11-24",
      "pushed_at": "2026-10-09"
    },
    {
      "full_name": "avelino/awesome-go",
      "url": "https://github.com/avelino/awesome-go",
      "description": "A curated list of awesome Go frameworks, libraries and software",
      "language": "Go",
      "stars_total": 187475,
      "stars_today": 30,
      "stars_today_source": "star_history",
      "forks": 13606,
      "created_at": "2014-07-06",
      "pushed_at": "2026-10-09"
    },
    {
      "full_name": "n8n-io/n8n",
      "url": "https://github.com/n8n-io/n8n",
      "description": "Fair-code workflow automation platform with native AI capabilities. Combine visual building with custom code, self-host or cloud, 400+ integrations.",
      "language": "TypeScript",
      "stars_total": 206789,
      "stars_today": 29,
      "stars_today_source": "star_history",
      "forks": 61028,
      "created_at": "2019-06-22",
      "pushed_at": "2026-10-09"
    },
    {
      "full_name": "ohmyzsh/ohmyzsh",
      "url": "https://github.com/ohmyzsh/ohmyzsh",
      "description": "🙃   A delightful community-driven (with 2,500+ contributors) framework for managing your zsh configuration. Includes 300+ optional plugins (rails, git, macOS, hub, docker, homebrew, node, php, python, etc), 140+ themes to spice up your morning, and an auto-update tool that makes it easy to keep up with the latest updates from the community.",
      "language": "Shell",
      "stars_total": 190059,
      "stars_today": 20,
      "stars_today_source": "star_history",
      "forks": 28745,
      "created_at": "2009-08-28",
      "pushed_at": "2026-10-09"
    },
    {
      "full_name": "nilbuild/developer-roadmap",
      "url": "https://github.com/nilbuild/developer-roadmap",
      "description": "Interactive roadmaps, guides and other educational content to help developers grow in their careers.",
      "language": "TypeScript",
      "stars_total": 369012,
      "stars_today": 19,
      "stars_today_source": "star_history",
      "forks": 45052,
      "created_at": "2017-03-15",
      "pushed_at": "2026-10-09"
    },
    {
      "full_name": "flutter/flutter",
      "url": "https://github.com/flutter/flutter",
      "description": "Flutter makes it easy and fast to build beautiful apps for mobile and beyond",
      "language": "Dart",
      "stars_total": 179203,
      "stars_today": 19,
      "stars_today_source": "star_history",
      "forks": 33363,
      "created_at": "2015-03-06",
      "pushed_at": "2026-10-09"
    },
    {
      "full_name": "tensorflow/tensorflow",
      "url": "https://github.com/tensorflow/tensorflow",
      "description": "An Open Source Machine Learning Framework for Everyone",
      "language": "C++",
      "stars_total": 200573,
      "stars_today": 14,
      "stars_today_source": "star_history",
      "forks": 78697,
      "created_at": "2015-11-07",
      "pushed_at": "2026-10-09"
    },
    {
      "full_name": "Significant-Gravitas/AutoGPT",
      "url": "https://github.com/Significant-Gravitas/AutoGPT",
      "description": "AutoGPT is the vision of accessible AI for everyone, to use and to build on. Our mission is to provide the tools, so that you can focus on what matters.",
      "language": "Python",
      "stars_total": 187494,
      "stars_today": 5,
      "stars_today_source": "star_history",
      "forks": 45929,
      "created_at": "2023-03-16",
      "pushed_at": "2026-10-09"
    },
    {
      "full_name": "freeCodeCamp/freeCodeCamp",
      "url": "https://github.com/freeCodeCamp/freeCodeCamp",
      "description": "freeCodeCamp.org's open-source codebase and curriculum. Learn math, programming, and computer science for free.",
      "language": "TypeScript",
      "stars_total": 456744,
      "stars_today": 4,
      "stars_today_source": "star_history",
      "forks": 48584,
      "created_at": "2014-12-24",
      "pushed_at": "2026-10-09"
    },
    {
      "full_name": "twbs/bootstrap",
      "url": "https://github.com/twbs/bootstrap",
      "description": "The most popular HTML, CSS, and JavaScript framework for developing responsive, mobile first projects on the web.",
      "language": "MDX",
      "stars_total": 174792,
      "stars_today": 1,
      "stars_today_source": "star_history",
      "forks": 78543,
      "created_at": "2011-07-29",
      "pushed_at": "2026-10-08"
    }
  ],
  "gaps": [
    "候选集口径：搜索 API q=pushed:>=2026-10-08+stars:>=100（T-1d=2026-10-08），total_count≈26126（多次请求间在 26109–26127 波动，属实时变化），按 sort=stars&order=desc 取前 100 为候选。",
    "本地差分 0 条：work/ 下仅存在今日（2026-10-09）的 collect.json，无「早于今日的上一自然日」基线（同日重跑不读取当日自身产物），故全部 20 条 stars_today 均走 star_history 兜底，stars_today_source=star_history。",
    "star_history 调用 20 次（达 spec 上限 20 次/轮），均成功返回，按 stars_total 降序依次处理候选前 20 个，无 stars_today=null 的候选。",
    "受 star_history 上限约束，候选集前 100 个中其余 80 个未计算 stars_today、未纳入榜单。",
    "工具单次网页响应约 55KB 后自动截断，搜索 API 以 per_page=8 分页获取；个别候选（avelino/awesome-go、langgenius/dify）响应末尾少量字段被截断，但本产物所需字段（全名/描述/语言/stars_total/forks/created_at/pushed_at）均完整。"
  ]
}
