{
  "date": "2026-10-22",
  "collected_at": "2026-10-22 04:10",
  "github": [
    {
      "full_name": "morluto/rea",
      "url": "https://github.com/morluto/rea",
      "description": "Reverse engineer anything with agents, from app behavior down to native binaries.",
      "language": "TypeScript",
      "stars_total": 356647,
      "stars_today": 1468,
      "stars_today_source": "local_diff",
      "forks": 89547,
      "created_at": "2026-04-14",
      "pushed_at": "2026-10-21"
    },
    {
      "full_name": "mattpocock/skills",
      "url": "https://github.com/mattpocock/skills",
      "description": "Skills for Real Engineers. Straight from my .agents directory.",
      "language": "Shell",
      "stars_total": 299723,
      "stars_today": 199,
      "stars_today_source": "local_diff",
      "forks": 25165,
      "created_at": "2026-02-03",
      "pushed_at": "2026-10-21"
    },
    {
      "full_name": "obra/superpowers",
      "url": "https://github.com/obra/superpowers",
      "description": "An agentic skills framework & software development methodology that works.",
      "language": "Shell",
      "stars_total": 303091,
      "stars_today": 103,
      "stars_today_source": "local_diff",
      "forks": 27006,
      "created_at": "2025-10-09",
      "pushed_at": "2026-10-21"
    },
    {
      "full_name": "firecrawl/firecrawl",
      "url": "https://github.com/firecrawl/firecrawl",
      "description": "Supercharge your AI agents with data from the web and beyond. Building the library for superintelligence. 🔥",
      "language": "TypeScript",
      "stars_total": 193873,
      "stars_today": 99,
      "stars_today_source": "local_diff",
      "forks": 10227,
      "created_at": "2024-04-15",
      "pushed_at": "2026-10-21"
    },
    {
      "full_name": "anomalyco/opencode",
      "url": "https://github.com/anomalyco/opencode",
      "description": "The open source coding agent.",
      "language": "TypeScript",
      "stars_total": 219599,
      "stars_today": 72,
      "stars_today_source": "local_diff",
      "forks": 29293,
      "created_at": "2025-04-30",
      "pushed_at": "2026-10-21"
    },
    {
      "full_name": "public-apis/public-apis",
      "url": "https://github.com/public-apis/public-apis",
      "description": "A collective list of free APIs",
      "language": "Python",
      "stars_total": 491107,
      "stars_today": 59,
      "stars_today_source": "local_diff",
      "forks": 54589,
      "created_at": "2016-03-20",
      "pushed_at": "2026-10-21"
    },
    {
      "full_name": "NousResearch/hermes-agent",
      "url": "https://github.com/NousResearch/hermes-agent",
      "description": "The agent that grows with you",
      "language": "Python",
      "stars_total": 255846,
      "stars_today": 53,
      "stars_today_source": "local_diff",
      "forks": 55780,
      "created_at": "2025-07-22",
      "pushed_at": "2026-10-21"
    },
    {
      "full_name": "vinta/awesome-python",
      "url": "https://github.com/vinta/awesome-python",
      "description": "The definitive list that answers \"I want to do X in Python, which tool should I use?\"",
      "language": "Python",
      "stars_total": 329236,
      "stars_today": 49,
      "stars_today_source": "local_diff",
      "forks": 28974,
      "created_at": "2014-06-27",
      "pushed_at": "2026-10-21"
    },
    {
      "full_name": "yt-dlp/yt-dlp",
      "url": "https://github.com/yt-dlp/yt-dlp",
      "description": "A feature-rich command-line audio/video downloader",
      "language": "Python",
      "stars_total": 199962,
      "stars_today": 47,
      "stars_today_source": "local_diff",
      "forks": 17423,
      "created_at": "2020-10-26",
      "pushed_at": "2026-10-21"
    },
    {
      "full_name": "torvalds/linux",
      "url": "https://github.com/torvalds/linux",
      "description": "Linux kernel source tree",
      "language": "C",
      "stars_total": 253025,
      "stars_today": 25,
      "stars_today_source": "local_diff",
      "forks": 68029,
      "created_at": "2011-09-04",
      "pushed_at": "2026-10-21"
    },
    {
      "full_name": "n8n-io/n8n",
      "url": "https://github.com/n8n-io/n8n",
      "description": "Fair-code workflow automation platform with native AI capabilities. Combine visual building with custom code, self-host or cloud, 400+ integrations.",
      "language": "TypeScript",
      "stars_total": 208241,
      "stars_today": 16,
      "stars_today_source": "local_diff",
      "forks": 61220,
      "created_at": "2019-06-22",
      "pushed_at": "2026-10-21"
    },
    {
      "full_name": "openclaw/openclaw",
      "url": "https://github.com/openclaw/openclaw",
      "description": "The AI that really does things. Any OS. Any Platform. The lobster way. 🦞 ",
      "language": "TypeScript",
      "stars_total": 392679,
      "stars_today": 15,
      "stars_today_source": "local_diff",
      "forks": 82545,
      "created_at": "2025-11-24",
      "pushed_at": "2026-10-21"
    },
    {
      "full_name": "freeCodeCamp/freeCodeCamp",
      "url": "https://github.com/freeCodeCamp/freeCodeCamp",
      "description": "freeCodeCamp.org's open-source codebase and curriculum. Learn math, programming, and computer science for free.",
      "language": "TypeScript",
      "stars_total": 457636,
      "stars_today": 11,
      "stars_today_source": "local_diff",
      "forks": 49298,
      "created_at": "2014-12-24",
      "pushed_at": "2026-10-21"
    },
    {
      "full_name": "microsoft/vscode",
      "url": "https://github.com/microsoft/vscode",
      "description": "Visual Studio Code",
      "language": "TypeScript",
      "stars_total": 194185,
      "stars_today": 8,
      "stars_today_source": "local_diff",
      "forks": 45480,
      "created_at": "2015-09-03",
      "pushed_at": "2026-10-21"
    },
    {
      "full_name": "react/react",
      "url": "https://github.com/react/react",
      "description": "The library for web and native user interfaces.",
      "language": "JavaScript",
      "stars_total": 251618,
      "stars_today": 6,
      "stars_today_source": "local_diff",
      "forks": 51563,
      "created_at": "2013-05-24",
      "pushed_at": "2026-10-21"
    },
    {
      "full_name": "tensorflow/tensorflow",
      "url": "https://github.com/tensorflow/tensorflow",
      "description": "An Open Source Machine Learning Framework for Everyone",
      "language": "C++",
      "stars_total": 201167,
      "stars_today": 5,
      "stars_today_source": "local_diff",
      "forks": 79341,
      "created_at": "2015-11-07",
      "pushed_at": "2026-10-21"
    },
    {
      "full_name": "microsoft/markitdown",
      "url": "https://github.com/microsoft/markitdown",
      "description": "Python tool for converting files and office documents to Markdown.",
      "language": "Python",
      "stars_total": 191470,
      "stars_today": 0,
      "stars_today_source": "star_history",
      "forks": 14258,
      "created_at": "2024-11-13",
      "pushed_at": "2026-10-21"
    },
    {
      "full_name": "ohmyzsh/ohmyzsh",
      "url": "https://github.com/ohmyzsh/ohmyzsh",
      "description": "🙃   A delightful community-driven (with 2,500+ contributors) framework for managing your zsh configuration. Includes 300+ optional plugins (rails, git, macOS, hub, docker, homebrew, node, php, python, etc), 140+ themes to spice up your morning, and an auto-update tool that makes it easy to keep up with the latest updates from the community.",
      "language": "Shell",
      "stars_total": 190100,
      "stars_today": 0,
      "stars_today_source": "star_history",
      "forks": 29340,
      "created_at": "2009-08-28",
      "pushed_at": "2026-10-21"
    },
    {
      "full_name": "Significant-Gravitas/AutoGPT",
      "url": "https://github.com/Significant-Gravitas/AutoGPT",
      "description": "AutoGPT is the vision of accessible AI for everyone, to use and to build on. Our mission is to provide the tools, so that you can focus on what matters.",
      "language": "Python",
      "stars_total": 187697,
      "stars_today": 0,
      "stars_today_source": "star_history",
      "forks": 45908,
      "created_at": "2023-03-16",
      "pushed_at": "2026-10-21"
    },
    {
      "full_name": "ollama/ollama",
      "url": "https://github.com/ollama/ollama",
      "description": "Get up and running with Kimi, GLM, MiniMax, DeepSeek, gpt-oss, Qwen, Gemma and other models.",
      "language": "Go",
      "stars_total": 184184,
      "stars_today": 0,
      "stars_today_source": "star_history",
      "forks": 18474,
      "created_at": "2023-06-26",
      "pushed_at": "2026-10-21"
    }
  ],
  "gaps": [
    "候选 100 个，入榜 20 个",
    "star_history 调用 20 次（上限 20），失败 0 次",
    "未纳入 16 个有增量的候选（排名在 20 之后）"
  ]
}
